{
  "type": "wizardry_party",
  "title": "Create Your Party",
  "description": "Assemble your adventuring party of three heroes to embark on the journey through Î©mega Spiral.",
  "characterCreation": {
    "availableClasses": [
      "Fighter",
      "Mage",
      "Priest",
      "Thief",
      "Bard",
      "Paladin",
      "Ranger"
    ],
    "availableRaces": [
      "Human",
      "Elf",
      "Dwarf",
      "Gnome",
      "Halfling",
      "HalfElf"
    ],
    "partySize": 3
  },
  "ui": {
    "namePrompt": "Enter character name:",
    "classLabel": "Choose class:",
    "raceLabel": "Choose race:",
    "statsLabel": "Character Stats:",
    "partyLabel": "Current Party:",
    "addButtonText": "Add to Party",
    "finishButtonText": "Begin Adventure"
  },
  "validation": {
    "requireUniqueNames": true,
    "minimumStats": {
      "strength": 3,
      "intelligence": 3,
      "wisdom": 3,
      "dexterity": 3,
      "constitution": 3,
      "charisma": 3
    }
  }
}